"","pub_date","main","score"
"2181","1990-03-29","Tele-Communications Inc. reports earnings for Year Dec 31",0
"2182","1990-03-29","INSIDE",0
"2183","1990-03-29","Trouble Right Here in Cincinnati: Furor Over Mapplethorpe Exhibit",0
"2184","1990-03-29","Chemical's Banking Plan",0
"2185","1990-03-29","International Mahogany reports earnings for Year to Dec 31",0
"2186","1990-03-29","HOUSE VOTES BILL TO ELEVATE E.P.A. TO CABINET LEVEL",0
"2187","1990-03-29","Spectrum Control reports earnings for Qtr to Nov 30",0
"2188","1990-03-29","Basketball;   Nets End Slump Against Knicks",-0.2
"2189","1990-03-29","Sports People: Baseball;   Rangers' Franco Ailing",-0.166666666666667
"2190","1990-03-29","Gerald F. Wright, Engineer, 85",0
"2191","1990-03-29","First Bancorp (N.C.) reports earnings for 12mo Dec 31",0
"2192","1990-03-29","Paper Shifts In Detroit",0
"2193","1990-03-29","Reviews/Music;   In Boston, a Chorus Presents a New Oratorio on Slavery",0
"2194","1990-03-29","Guilty Plea In Pentagon Fraud Case",-0.4
"2195","1990-03-29","Pact Lets Jacobs Seek CML Votes",-0.166666666666667
"2196","1990-03-29","The U.N. Today",0
"2197","1990-03-29","Washington at Work;   Bush's Adviser on Domestic Policy: The Perfect Person to Win the Point",0.1
"2198","1990-03-29","Precision Drilling reports earnings for Qtr to Jan 31",0.166666666666667
"2199","1990-03-29","Critic's Notebook;   Farrakhan's Soft New Voice and Same Message",0
"2200","1990-03-29","Jeanne T. Block, 57, A Civic Leader on L.I.",-0.25
"2201","1990-03-30","Books of The Times;   Horrors as No More Than Part of Life",-0.2
"2202","1990-03-30","NBC Says 'Cosby' to Return, Without a Bonus Agreement",0.428571428571429
"2203","1990-03-30","Penn Traffic Co. reports earnings for 14wk to Feb 3",0
"2204","1990-03-30","7 Days Magazine Is for Sale",0
"2205","1990-03-30","Orbit Oil & Gas reports earnings for Year Dec 31",0
"2206","1990-03-30","The Two Nations",0
"2207","1990-03-30","Review/Film;   Nonstop Action in 'Mutant Ninja Turtles'",0
"2208","1990-03-30","For Children",0
"2209","1990-03-30","George, Howie, Donald",0
"2210","1990-03-30","50th Performance By Free Theater Project",0.25
"2211","1990-03-30","Survey in Moscow Sees a High Level of Anti-Jewish Feeling",0
"2212","1990-03-30","Fire in the Bronx;   Fire Survivor Tells Of 'All the Screams' He 'Can't Forget'",-0.375
"2213","1990-03-30","Muti to Quit Philadelphia Orchestra",-0.25
"2214","1990-03-30","Quotation of the Day",0
"2215","1990-03-30","Mussmann And Troupe: Enigmas In Motion",0
"2216","1990-03-30","Hadson Energy Resources reports earnings for Year to Dec 31",0.142857142857143
"2217","1990-03-30","Newmont Selling Stake In Coal Unit",0
"2218","1990-03-30","Jefferson Smurfit In Recycling Deal",0
"2219","1990-03-30","THE MEDIA BUSINESS: Advertising;   People",0
"2220","1990-03-30","Satellites Find No Sign of Global Warming in 80's",0.2
"2221","1990-03-30","Cruising New York's Waters",0
"2222","1990-03-30","Advisers in Forefront Of New Proxy Wars",0
"2223","1990-03-30","THE MEDIA BUSINESS: Advertising;   Smartfoods for Mullen",0
"2224","1990-03-30","Enquirer Sets Deal for Star",0
"2225","1990-03-30","Liberty Homes Inc. reports earnings for Year to Dec 31",0.142857142857143
"2226","1990-03-31","Frank Haynes Jr., 45, Lawyer at Prudential",0.25
"2227","1990-03-31","Suspect Is Arrested In Sex-Abuse Case",-0.25
"2228","1990-03-31","Review/Dance;   Nutty Sweetness, Young Love, a Trip and a Ritual",0.285714285714286
"2229","1990-03-31","Kind Word for Lyndon Johnson",0.25
"2230","1990-03-31","Calton Inc. reports earnings for Qtr to Feb 28",0
"2231","1990-03-31","Hurley Proving He's Focal Point For Blue Devils",-0.285714285714286
"2232","1990-03-31","Motorola Freed to Sell Chip in Hitachi Suit",0.166666666666667
"2233","1990-03-31","Doctor Aboard Copter Is Hit by Ground Shots",-0.166666666666667
"2234","1990-03-31","5-Year Vivaldi Festival To Start on May 9",0.2
"2235","1990-03-31","U.S. Says Fire at Libya Arms Plant May Be a Hoax",-0.142857142857143
"2236","1990-03-31","U.S. Will Avoid Inflaming Crisis, Bush Assures Gorbachev in Note",-0.125
"2237","1990-03-31","81 Nations Seeking More Food Aid for Africa",0.2
"2238","1990-03-31","4-Way Tie For Lead In Tradition",0.5
"2239","1990-03-31","Patents;   A Device to Keep Autos Constantly Tuned Up",0
"2240","1990-03-31","Nonunion Workers And UAL Buyout",0
"2241","1990-03-31","U.S. Urged to Resolve Problem at Arms Plant",0
"2242","1990-03-31","At P.S. 92, a Hope That Money Will Flow Again",0.5
"2243","1990-03-31","Lennar Corp. reports earnings for Qtr to Feb 28",0
"2244","1990-03-31","Teacher in Drug Case Is Given Probation; Officials Urged Jail",-0.125
"2245","1990-03-31","Hicks, Muse Buys 7 Insurers",0.25
"2246","1990-03-31","A Radio Station Fights To Keep Its Watts Up",-0.2
"2247","1990-03-31","CONSUMER'S WORLD: Guidepost;   Outdoor Furniture",0
"2248","1990-03-31","Japan's Inflation Rises",-0.333333333333333
"2249","1990-03-31","COMPANY BRIEFS",0.5
"2250","1990-03-31","4 Garbage Haulers See Charges Dropped",-0.4
"2251","1990-04-01","Opposites Share a Final Goal",0
"2252","1990-04-01","To a Fading U.S. Bugle, Rhineland Sings a Dirge",0
"2253","1990-04-01","The Ritual of Spring Changes for Guidry",0
"2254","1990-04-01","Democrats, Sick of Being 'Responsible,' Let Loose",-0.2
"2255","1990-04-01","HARNONCOURT'S MOZART SHOWS STEADY GROWTH",0
"2256","1990-04-01","Czechs' Strategy Helps U.S.",0
"2257","1990-04-01","Works in Progress;   Fill'er Up",0.333333333333333
"2258","1990-04-01","Lifestyle;   If This Is Friday and That's a Beer, We Must Be in the Love Transporter",0.142857142857143
"2259","1990-04-01","Campus Life: Kansas;   Tenured Professor Is Dismissed On Ethics Charges",-0.125
"2260","1990-04-01","Having Babies: Another Viewpoint",0
"2261","1990-04-01","Getting Close to Nature in Montana",0
"2262","1990-04-01","'The Aftermath': A Film's Real-Life Lesson on Drunken Driving",-0.333333333333333
"2263","1990-04-01","Mariquita Patterson to Wed",0
"2264","1990-04-01","QUESTION OF THE WEEK: Next Week;   What Is Wrong With the Knicks?",-0.333333333333333
"2265","1990-04-01","Data Bank/April 1, 1990",0
"2266","1990-04-01","No to a Germany With a Foot in Each Camp",0
"2267","1990-04-01","Leaping Into the Unknown",0
"2268","1990-04-01","The Environment: A Time to Act",0
"2269","1990-04-01","Tina Rosenbaum Weds",0
"2270","1990-04-01","Penn Varsity Holds Off Yale in Blackwell Cup",0
"2271","1990-04-01","A Reminder",0
"2272","1990-04-01","GOOD BOOKS ABUT BEING SICK",0
"2273","1990-04-01","Spain's Savory Suckling Pig",0
"2274","1990-04-01","Shuttle Launching Moved Up",0
"2275","1990-04-01","Campus Life: Chicago;   A Professor Whose Father Helped Shape Soviet History",0
"2276","1990-04-02","Georgia Journal;   Auto Tags Offer State Unnerving Lottery",0.125
"2277","1990-04-02","International Yogurt reports earnings for Qtr to March 31",0
"2278","1990-04-02","Defense for Noriega Asserts That U.S., Not He, Is Guilty",0
"2279","1990-04-02","National Pastime Hearing Footsteps",0
"2280","1990-04-02","Republic Gypsum reports earnings for Qtr to March 31",0
"2281","1990-04-02","Exabyte Corp. reports earnings for Qtr to March 31",0
"2282","1990-04-02","J.A.M.  Inc. reports earnings for Qtr to March 31",0
"2283","1990-04-02","Balfour Maclaine Corp. reports earnings for Qtr to March 31",0
"2284","1990-04-02","Healthwatch Inc. reports earnings for Qtr to March 31",0
"2285","1990-04-02","Barry's Jewelers reports earnings for Qtr to Feb 28",0
"2286","1990-04-02","Homeplex Mortgage Investents reports earnings for Qtr to March 31",0
"2287","1990-04-02","Ilene S. Kleckner Wed To Kent R. Friedman",0
"2288","1990-04-02","CORRECTION",1
"2289","1990-04-02","Teen-Ager Is Shot Dead In a Brooklyn Robbery",-0.6
"2290","1990-04-02","Genrad Inc. reports earnings for Qtr to March 31",0
"2291","1990-04-02","LSI Logic Corp. of Canada reports earnings for Qtr to April 1",0.125
"2292","1990-04-02","Dividend Meetings",0.5
"2293","1990-04-02","Omnicom Group reports earnings for Qtr to March 31",0
"2294","1990-04-02","MDC Corp. reports earnings for Qtr to Feb 28",0
"2295","1990-04-02","Iowa Resources reports earnings for 12mo March 31",0.2
"2296","1990-04-02","DeRose Industries Inc.  reports earnings for Qtr to March 31",0.142857142857143
"2297","1990-04-02","Review/Opera;   'Rheingold' Raises Curtain on Met's 1990 'Ring'",-0.166666666666667
"2298","1990-04-02","Pathe's Chief Gets 4-Year Jail Term",-0.333333333333333
"2299","1990-04-02","Ducommun Inc. reports earnings for Qtr to March 31",0
"2300","1990-04-02","STOCKS PLUMMET ON TOKYO MARKET",0
"2301","1990-04-03","Energy Report Issued",0
"2302","1990-04-03","U.S. Regains Export Lead",0.333333333333333
"2303","1990-04-03","Market Place;   Strange Calm After Tokyo's Fall",0
"2304","1990-04-03","Weak Profits Seen for Banks Hurt by Real Estate Loans",0.125
"2305","1990-04-03","Herbalife International reports earnings for Year to Dec 31",0
"2306","1990-04-03","Suspect in Stabbing of Wife Is Found Struck by Lightning",-0.5
"2307","1990-04-03","Quake Jars Central England",-0.25
"2308","1990-04-03","Maxtor in Offer For Miniscribe",0.333333333333333
"2309","1990-04-03","Profit Systems reports earnings for Qtr to Dec 31",0.166666666666667
"2310","1990-04-03","U.S. Gaining Ground at U.N., State Department Study Says",0.166666666666667
"2311","1990-04-03","Strober Organization reports earnings for Qtr to Dec 31",0.166666666666667
"2312","1990-04-03","Auto Pollution Has Decreased for a Decade;   Raise Tax on Gas",-0.714285714285714
"2313","1990-04-03","Difficulties in Real Estate Extend Even to Minneapolis",0
"2314","1990-04-03","Spartan Motors Inc. reports earnings for Qtr to Dec 31",0
"2315","1990-04-03","Oil Company Agrees to Buy Homes of Those Who Sued It",0.4
"2316","1990-04-03","Iraq Can Deliver, U.S. Chemical Arms Experts Say",0.142857142857143
"2317","1990-04-03","Research in 'Virgin' Amazon Uncovers Complex Farming",-0.166666666666667
"2318","1990-04-03","Review/Music;   New Works for New Ears",0
"2319","1990-04-03","Linpro Specified Properties reports earnings for Year to Dec 31",0
"2320","1990-04-03","HIGH COURT BACKS STAY OF EXECUTION",0.2
"2321","1990-04-03","Trump Group Makes Bid For Bonwit",0
"2322","1990-04-03","Seltz Journal;   Alsace: Its French-German Nerves Are Showing",-0.166666666666667
"2323","1990-04-03","Treasuries Fall in Light Trading",0
"2324","1990-04-03","S.E.C. Chief Criticizes Bill to Thwart Takeovers",-0.333333333333333
"2325","1990-04-03","Review/Television;   The New Days in Leningrad Are Freer, Not Easier",0
"2326","1990-04-04","Landlord of Burned-Out Club Surrenders",-0.25
"2327","1990-04-04","SENATORS APPROVE CLEAN AIR MEASURE BY A VOTE OF 89-11",0.5
"2328","1990-04-04","MCorp reports earnings for Qtr to Dec 31",0
"2329","1990-04-04","Leo van Munching, 88, Heineken Beer Trader",0
"2330","1990-04-04","KILLINGS OF ARABS BY ISRAELIS DROP",-0.5
"2331","1990-04-04","Navratilova Motivated After Losing to Zvereva",0
"2332","1990-04-04","C.D.'s and Bank Funds Post Mixed Yields for the Week",-0.142857142857143
"2333","1990-04-04","BUSINESS DIGEST",0
"2334","1990-04-04","American Schools Abroad Find a Global Niche",0.166666666666667
"2335","1990-04-04","Ruddock-Dokes Matchup Headlines Card at Garden",0
"2336","1990-04-04","Music Played in 1971 as Police Found Bodies of 5",0.2
"2337","1990-04-04","PEC Israel Economic Corp. reports earnings for Year to Dec 31",0.125
"2338","1990-04-04","Court Urges Easing on Phone Curbs",0.4
"2339","1990-04-04","People",0
"2340","1990-04-04","Economic Scene;   Cellular Phones: Room for Three?",0.166666666666667
"2341","1990-04-04","Rebels No. 1, at Last; No Replays Needed",-0.5
"2342","1990-04-04","The Shark Has Swum A Long Way",-0.25
"2343","1990-04-04","Gretzky Out of Lineup",0
"2344","1990-04-04","Intergroup Filing",0
"2345","1990-04-04","South Africa Sends Army to Halt Strife",-0.166666666666667
"2346","1990-04-04","Met Opera Reaches Pact For Summer Attractions",0.166666666666667
"2347","1990-04-04","American Medical Internaional Inc. reports earnings for Qtr to Feb 28",0
"2348","1990-04-04","G.E. Names a Lawyer To Environment Post",0
"2349","1990-04-04","Congress May Consider Liquor Ad Warnings",0.2
"2350","1990-04-04","Kemp's Choice Is Ruled Out for a New Post",0
"2351","1990-04-05","Western Wind Across Urban Plains",0.2
"2352","1990-04-05","Edgar G. E. Moss; Dog Breeder, 83",0
"2353","1990-04-05","Ault Inc.  reports earnings for Qtr to Feb 25",0
"2354","1990-04-05","Sarah Vaughan, 'Divine One' Of Jazz Singing, Is Dead at 66",0
"2355","1990-04-05","Maxtor Accepted In Miniscribe Bid",0.25
"2356","1990-04-05","Railroad Fincl Corp.  reports earnings for Qtr to Dec 31",0
"2357","1990-04-05","Contel to Combine Telephone Groups",0
"2358","1990-04-05","ACS Enterprises reports earnings for Qtr to Dec 31",0
"2359","1990-04-05","House Drafting Stiff Bill on Urban Air Pollution",-0.142857142857143
"2360","1990-04-05","Delaware Otsego reports earnings for Year to Dec 31",0
"2361","1990-04-05","Q&A",NA
"2362","1990-04-05","Ruddock Stops Dokes With 3 Lefts in the 4th",0
"2363","1990-04-05","ICN Biomedicals reports earnings for Qtr to Feb 28",0
"2364","1990-04-05","American Oil & Gas Corp. reports earnings for Qtr to Dec 31",0
"2365","1990-04-05","Calendar of Events: Springtime Flowers",0
"2366","1990-04-05","Chief Consolidated Mining reports earnings for Year to Dec 31",0
"2367","1990-04-05","Arts Endowment Hearing Scene of Emotional Debate",0.166666666666667
"2368","1990-04-05","Oklahoma Faces Suit",0.333333333333333
"2369","1990-04-05","Publicker Industries reports earnings for Qtr to Dec 31",0.166666666666667
"2370","1990-04-05","Group of 7 Meeting Is Expected to Be Quiet",0.25
"2371","1990-04-05","Petroleum Development reports earnings for Year Dec 31",0
"2372","1990-04-05","Margate Ventures reports earnings for Qtr to Dec 31",0
"2373","1990-04-05","Continental Pharma Cryosan Inc.  reports earnings for Qtr to Jan 31",0
"2374","1990-04-05","A Hard Road For Mandela;   Doubt About Support Is Clouding Prospects",-0.142857142857143
"2375","1990-04-05","Collaborative Research Inc.  reports earnings for Qtr to Mar 3",0
"2376","1990-04-06","Corel Systems reports earnings for Qtr to Feb 28",0
"2377","1990-04-06","Chronicle",0
"2378","1990-04-06","When We Awake From Our Dream World",0
"2379","1990-04-06","Law Schools Boycotted Over Lack of Minority Teachers",0
"2380","1990-04-06","Kaifu Praises Trade Deal But Sees Some Difficulties",0
"2381","1990-04-06","AT THE MOVIES",0
"2382","1990-04-06","Biomagnetic Technologies reports earnings for Qtr to Dec 31",0
"2383","1990-04-06","Pro Bono",0.5
"2384","1990-04-06","Study Finds Little Lasting Distress From Abortion",-0.333333333333333
"2385","1990-04-06","Panel Says Sessions Tolerates F.B.I. Discrimination",-0.166666666666667
"2386","1990-04-06","A Skewed Vision of a Small Town In 'Twin Peaks,'",0
"2387","1990-04-06","Chronicle",0
"2388","1990-04-06","Baby and 3 Men Shot to Death In Manhattan",-0.4
"2389","1990-04-06","Old and New Masters Pass In the Light",0.4
"2390","1990-04-06","Rowland H. S. Bedell; Ophthalmologist, 55",0
"2391","1990-04-06","Valvano Loses Chance",-0.333333333333333
"2392","1990-04-06","Yanks Try to Relieve Feelings in the Bullpen",0
"2393","1990-04-06","Bethlehem Steel Penalized $1 Million on Benzene Fumes",0
"2394","1990-04-06","A Streamlined Morgan Stanley",0
"2395","1990-04-06","Bushes See Michael Jackson",0
"2396","1990-04-06","Auctions",0
"2397","1990-04-06","Country Lake Foods Inc. reports earnings for Qtr to Dec 31",0
"2398","1990-04-06","Alatenn reports earnings for Qtr to Dec 31",0
"2399","1990-04-06","Port Authority Drops Plan For Rise in Tolls and Fares",0
"2400","1990-04-06","Review/Film;   A New-Age Comedy, Crystals And All",0.25
"2401","1990-04-07","Creaky I.R.S. Is at a Crossroads",0
"2402","1990-04-07","Poindexter Jury Is Still Out",0
"2403","1990-04-07","Come Back and Let's Try to Work It Out",0
"2404","1990-04-07","Presidential Realty reports earnings for Year to Dec 31",0
"2405","1990-04-07","Review/Theater;   Distillation of 'A Tale of Two Cities'",0
"2406","1990-04-07","If It's Legal, City May Try Complex Bond Refinancing",-0.142857142857143
"2407","1990-04-07","Lawrence Stayer, 49, Met Auditions Director",0
"2408","1990-04-07","New Odors From the H.U.D. Swamp",0
"2409","1990-04-07","Nancy Lady Keith Is Dead at 73; A Socialite Known for Her Wit",-0.142857142857143
"2410","1990-04-07","Judge Releases Man in Killing Of an Intruder",-0.2
"2411","1990-04-07","South African Draft Evader Is Granted Asylum in U.S.",-0.166666666666667
"2412","1990-04-07","Patents;   Using an Ion Beam To Paint Car Pinstripes",0.142857142857143
"2413","1990-04-07","Bridge",0
"2414","1990-04-07","Sports People: BASEBALL;   Cubs' Sutcliffe Goes On 21-Day Disabled List",-0.111111111111111
"2415","1990-04-07","Ex-Bank Officer Says He Got Marcos Interest",0.166666666666667
"2416","1990-04-07","Puerto Rico Is Seen Facing Economic Troubles as State",0.142857142857143
"2417","1990-04-07","BUSINESS DIGEST: SATURDAY, APRIL 7, 1990",0
"2418","1990-04-07","Brendle's reports earnings for Qtr to Feb 3",0
"2419","1990-04-07","Upheaval in the East;   D'AMATO STOPPED AT POLISH BORDER",0
"2420","1990-04-07","Barringer Labs reports earnings for Year to Dec 31",0
"2421","1990-04-07","U.S. Is in Middle of 33 Nations in Death Rates",-0.25
"2422","1990-04-07","OWNER BACKS SALE OF UNITED AIRLINES TO WORKER GROUP",0.142857142857143
"2423","1990-04-07","42 Warrants For Owner Of Fire Site",-0.25
"2424","1990-04-07","Jury Supports Genentech In Patent Infringement Case",0
"2425","1990-04-07","Bitterness Lingers Over Treatment of LaFontaine",-0.25
"2426","1990-04-08","Pastimes;   Around the Garden",0
"2427","1990-04-08","Q and A",NA
"2428","1990-04-08","Curtains For a Grand Screen",0.333333333333333
"2429","1990-04-08","N.C. State Pays Valvano to Leave",0.5
"2430","1990-04-08","CONNECTICUT GUIDE",0.5
"2431","1990-04-08","Floyd Leads Masters By 2",0.666666666666667
"2432","1990-04-08","A Theatrical Family Faces the End of a Line",0
"2433","1990-04-08","Peter Wolfe Dies at 53; A Bank Vice President",-0.333333333333333
"2434","1990-04-08","HOPPING MAD IN MONTREAL",-0.333333333333333
"2435","1990-04-08","Residential Resales",0
"2436","1990-04-08","Ann C. Carey to Marry Jean C. Loisel",0.2
"2437","1990-04-08","Beating Time Warner at Its Own Game",0
"2438","1990-04-08","Angola Says It Will Begin Talks With Rebels Soon",0
"2439","1990-04-08","Economic Impact Of Older Consumers",0.25
"2440","1990-04-08","Campus Life: UC, Irvine;   What Do Students Want to Learn? Check the Returns",0.25
"2441","1990-04-08","Nobody Is Perfect",0.5
"2442","1990-04-08","U.S. and Allies Concerned by Yen's Fall",-0.25
"2443","1990-04-08","Tilden Senior Receives M.V.P. in Kearny Relay",0
"2444","1990-04-08","Shopping list for a nuclear bomb",-0.25
"2445","1990-04-08","Answering The Mail",0
"2446","1990-04-08","Wave of Conversions Slows to a Ripple",0
"2447","1990-04-08","Still Serving The Children",-0.333333333333333
"2448","1990-04-08","Islanders Lash Out At League",0
"2449","1990-04-08","NOTES ON REVOLUTION",-0.5
"2450","1990-04-08","Annexing Farmland",0
"2451","1990-04-09","Man Charged in Gang Rape Of a Mute Brooklyn Woman",0
"2452","1990-04-09","Designatronics Inc. reports earnings for Qtr to Feb 28",0
"2453","1990-04-09","INSIDE",0
"2454","1990-04-09","Devils Find Series Offensive",-0.5
"2455","1990-04-09","Ryan White Dies of AIDS at 18; His Struggle Helped Pierce Myths",-0.125
"2456","1990-04-09","Guidance or Censorship? New Debate on Rating Films.",-0.333333333333333
"2457","1990-04-09","Man Killed at $3-a-Head Party in Brooklyn",0
"2458","1990-04-09","East Germany Agrees on New Coalition",0
"2459","1990-04-09","7 Weeks Later, No Answers in Killing",-0.25
"2460","1990-04-09","Farm Aid Raises $1.3 Million",0
"2461","1990-04-09","Quality Book Publishing Shifts to Small Presses;   Who Gets Free Ride?",-0.111111111111111
"2462","1990-04-09","Scuba Class: A Journey Under and Within",0
"2463","1990-04-09","Showing Italian Flights Of More Than Fancy",0
"2464","1990-04-09","Lisa Brauer Wed to Scott McLaughlin",0
"2465","1990-04-09","BUSINESS DIGEST",0
"2466","1990-04-09","Cold Cash",-0.5
"2467","1990-04-09","Awaiting His Fate, His World Closes In",0
"2468","1990-04-09","Seeing Is Not Believing for Caps' Coach",0
"2469","1990-04-09","Trimel Corp.  reports earnings for Year to Dec 31",0
"2470","1990-04-09","Mets and Yankees Go Separate Ways",0
"2471","1990-04-09","Dividend Meetings",0.5
"2472","1990-04-09","BRIEFS",0
"2473","1990-04-09","Soviet Georgians Rally, Demanding Independence but Revealing Disunity",0.285714285714286
"2474","1990-04-09","Sizing Up Rules On Bats, Gloves",0
"2475","1990-04-09","Penobscot Shoe reports earnings for Qtr to Feb 23",0
"2476","1990-04-10","George Strawbridge, 80, a Leader Of Philadelphia Stockbrokerage",0
"2477","1990-04-10","Albany Budget Talks Stall Over Environmental Bond Issue",0
"2478","1990-04-10","Lincoln Bancorp reports earnings for Qtr to Mar 31",-0.166666666666667
"2479","1990-04-10","Granada Biosciences Inc. reports earnings for Qtr to Dec 31",0
"2480","1990-04-10","Market Place;   London Is Trying To Keep Its Lead",0
"2481","1990-04-10","Careers;   Managing A Diverse Work Force",-0.2
"2482","1990-04-10","Washington at Work;   To Stay Ahead of History, How Fast Must Jackson Run? And for What?",-0.111111111111111
"2483","1990-04-10","Premier Financial Services reports earnings for Qtr to Mar 31",-0.142857142857143
"2484","1990-04-10","Leary's Varied Path Leads to Big Opening",0.333333333333333
"2485","1990-04-10","Ancient Japanese Classic Suddenly Turns Sexy",0
"2486","1990-04-10","INSIDE",0
"2487","1990-04-10","Review/Cabaret;   Dixie Carter As a Madcap Miss Scarlett",-0.166666666666667
"2488","1990-04-10","BancTexas Group Inc. reports earnings for Year to Dec 31",0
"2489","1990-04-10","The Questions of Summer",-0.5
"2490","1990-04-10","Treasury Prices Dip in Slow Day",0
"2491","1990-04-10","Chess",0
"2492","1990-04-10","9 Fewer Rigs Working",0
"2493","1990-04-10","OBSCURE ENGINEER NOW THE FAVORITE TO LEAD PERUVIANS",0.166666666666667
"2494","1990-04-10","Corrections",1
"2495","1990-04-10","Melcor Developments reports earnings for Year to Dec 31",0
"2496","1990-04-10","PATTERNS",0
"2497","1990-04-10","Stake Technology reports earnings for Year to Dec 31",0
"2498","1990-04-10","KREMLIN HESITATES AS DEADLINE FALLS FOR ECONOMIC PLAN",0
"2499","1990-04-10","Cellular Information Systems reports earnings for Qtr to Dec 31",0.142857142857143
"2500","1990-04-10","EXECUTIVES",-1
"2501","1990-04-11","Shuttle Liftoff Postponed Because of a Bad Valve",-0.2
"2502","1990-04-11","INSIDE",0
"2503","1990-04-11","Bandag Inc. reports earnings for Qtr to Mar 31",-0.166666666666667
"2504","1990-04-11","Metro Datelines;   Private Citizen Lends $110,000 to County",0
"2505","1990-04-11","AEL Industries reports earnings for Qtr to Feb 23",0.166666666666667
"2506","1990-04-11","Mongolia's Communists Mapping Changes to Keep Grip on Power",0
"2507","1990-04-11","Coach Suspends Season",-0.333333333333333
"2508","1990-04-11","Corrections",1
"2509","1990-04-11","First Commercial Bancorp of Sacramento reports earnings for Qtr to Mar 31",-0.125
"2510","1990-04-11","Review/Music;   Comparing and Contrasting A and B",0
"2511","1990-04-11","GORBACHEV SPEAKS OF LITHUANIA MOVE",0
"2512","1990-04-11","WINE TALK",0
"2513","1990-04-11","Great Country Bank reports earnings for Qtr to Feb 28",0.142857142857143
"2514","1990-04-11","Hospital Workers in California Approve Pay Offer, Ending Strike",0.375
"2515","1990-04-11","Smith (A.O.) Corp.(A) reports earnings for Qtr to Mar 31",-0.166666666666667
"2516","1990-04-11","Metro Datelines;   Man Held in Shooting Is Linked to a Killing",-0.142857142857143
"2517","1990-04-11","Third Driver Is Killed In Bronx Cab Robbery",-0.333333333333333
"2518","1990-04-11","Harding Associates reports earnings for Qtr to Feb 28",0
"2519","1990-04-11","Carbide Review Is Delayed",-0.333333333333333
"2520","1990-04-11","Why Not a Secondhand Arms Treaty?",0.333333333333333
"2521","1990-04-11","For New York: More Than Money",0
"2522","1990-04-11","METROPOLITAN DIARY",0
"2523","1990-04-11","David M. Robb, Art Historian, 86",0.25
"2524","1990-04-11","To Chinese, Genghis Tomb Is No Mystery",0
"2525","1990-04-11","Auberges des Gouverneurs reports earnings for Year to Dec 31",0
"2526","1990-04-12","A Proposal And An Idea",0
"2527","1990-04-12","Twin Killing In College Game",0
"2528","1990-04-12","BRIEFS",0
"2529","1990-04-12","Tracking the Life Of the New Father",0
"2530","1990-04-12","Surgery Would Help More Epileptics, Panel Says",0
"2531","1990-04-12","Books of The Times;   The Everlasting Grip of Bonds Forged by War",0
"2532","1990-04-12","Caere Corp. reports earnings for Qtr to March 31",0
"2533","1990-04-12","Money-Fund Yields Mixed",-0.333333333333333
"2534","1990-04-12","NEWS SUMMARY",0
"2535","1990-04-12","Duratek Corp. reports earnings for Qtr to Dec 31",0
"2536","1990-04-12","Teledyne Inc. reports earnings for Qtr to March 31",0
"2537","1990-04-12","Washington Talk;   Execution Case Poses Classic Test for Court",0.125
"2538","1990-04-12","Jockey Banned 10 Years",0
"2539","1990-04-12","Where Paper Planes Fly, Census Plan Crashes",0
"2540","1990-04-12","Neworld Bancorp reports earnings for Qtr to March 31",0
"2541","1990-04-12","Raytheon Co. reports earnings for Qtr to March 31",0
"2542","1990-04-12","Currents;   A Silver Anniversary Of Landmark Status",0
"2543","1990-04-12","Violence in Kashmir Intensifying; India-Pakistan Relations Worsen",-0.333333333333333
"2544","1990-04-12","Homefed Corp. reports earnings for Qtr to March 31",0
"2545","1990-04-12","Israeli Coalition Cracks at Last Minute",0
"2546","1990-04-12","Willamette Industries reports earnings for Qtr to March 31",0.166666666666667
"2547","1990-04-12","INB Financial Corp. reports earnings for Qtr to March 31",0
