"","pub_date","main","score"
"6613","1990-09-22","Miss Barrios Wed To John C. O'Neill",-0.2
"6614","1990-09-22","Mandela, in a Conciliatory Mood, Agrees to Meet With Zulu Leader",0.142857142857143
"6615","1990-09-22","Woman Says Police Officers Bullied and Threatened Her",-0.166666666666667
"6616","1990-09-22","Spurs to Drop Wingate",-0.333333333333333
"6617","1990-09-22","Boeing Outlook On Plane Orders",0
"6618","1990-09-22","Corrections",1
"6619","1990-09-22","BUSINESS DIGEST: SATURDAY, SEPTEMBER 22, 1990",0
"6620","1990-09-22","Profit? Loss? A Primer for Soviets",0
"6621","1990-09-22","The Fed's Sensible Bank Experiment",0.25
"6622","1990-09-22","Review/Film Festival;   On Oppression of Women in China",0
"6623","1990-09-22","Prices of Treasury Securities Drop",0
"6624","1990-09-22","Lebanese Chief Signs a New Power-Sharing Law",0.166666666666667
"6625","1990-09-22","Corrections",1
"6626","1990-09-23","China's Great Dissident",0.333333333333333
"6627","1990-09-23","Music Festivals",0.5
"6628","1990-09-23","On Language;   Those Defining Moments",0.333333333333333
"6629","1990-09-23","Hale House Fights City Hall on Babies' Care",0
"6630","1990-09-23","Orchestrating The Birthday Bash",-0.333333333333333
"6631","1990-09-23","OILING THE SKIDS UNDER THE ECONOMY",0
"6632","1990-09-23","Henry Adams and His Friends",0.666666666666667
"6633","1990-09-23","MINING THE SILVER LININGS",-0.333333333333333
"6634","1990-09-23","Becker's Behavior Self-Defeating",0
"6635","1990-09-23","Kelli Ann Hunter Marries Theodore Krebsbach",0
"6636","1990-09-23","At Sea With McPhee",0
"6637","1990-09-23","Is There a Cheaper Way To Attack Rising Crime?",-0.4
"6638","1990-09-23","Beth Abrams To Wed in Fall",-0.25
"6639","1990-09-23","New Yorkers, etc.",0
"6640","1990-09-23","In the Democracy Of Nicaragua, Control Control Is Still From the Top",0
"6641","1990-09-23","Environment Problems: Home Rule Is Hurting Search for Solutions",-0.142857142857143
"6642","1990-09-23","Environmentalists, in New Twist, Vie for Control of Yosemite Business",-0.142857142857143
"6643","1990-09-23","For Israelis, Appeal of Occupied Territories Grows",0.2
"6644","1990-09-23","Catherine M. Colavecchio Is Married",0.333333333333333
"6645","1990-09-23","Maureen McCann Weds K.J. Conery",0
"6646","1990-09-23","Nuclear Waste Cleanup",-0.333333333333333
"6647","1990-09-23","Baseball: American League;   2 Consecutive Homers Life Indians Over Jays",0
"6648","1990-09-23","Why Bochco's Cops Say It With Music",0
"6649","1990-09-23","Year Later, St. Croix Is Coming Back, And Trying to Bring Tourists With It",0.125
"6650","1990-09-23","Q and A",NA
"6651","1990-09-24","CONFRONTATION IN THE GULF: Strains of Gulf Crisis;   Sharp Questioning by Congress Comes Amid Jockeying Among Bush Officials",-0.214285714285714
"6652","1990-09-24","Accounts",1
"6653","1990-09-24","Cutty Sark Is Updating Its Image",0
"6654","1990-09-24","Warmup Unit For Calves",0
"6655","1990-09-24","Ford and G.M. Closing Plants",0
"6656","1990-09-24","On the Sidewalks, Business Is Booming",0.333333333333333
"6657","1990-09-24","Reviews/Television;   Sharon Gless, Helping The Underdogs of Life",0
"6658","1990-09-24","Victoria Bennett, Film Maker, Wed",0
"6659","1990-09-24","Cardinal Is Denounced In Rally at St. Patrick's",0
"6660","1990-09-24","The Value of Pigs And Other Insights At Mead Film Festival",0.5
"6661","1990-09-24","Excerpts From Statement by Iraqi President Warning of the Effects of War",0
"6662","1990-09-24","15th-Century Portrait Is Stolen From Museum",-0.25
"6663","1990-09-24","Jets Confront Bills With New Outlook",-0.2
"6664","1990-09-24","Ballot Becomes a Burden in California",-0.25
"6665","1990-09-24","Ruling Adds to Uncertainty On Newspaper Sales Taxes",-0.166666666666667
"6666","1990-09-24","Hoop Trivia",0
"6667","1990-09-24","Chronicle",0
"6668","1990-09-24","Rift on Software Arouses Concerns",-0.25
"6669","1990-09-24","Miss Rapp Weds Joseph M. Lodato",-0.2
"6670","1990-09-24","Market Place;   When a Big Bull Is Forced to Sell",-0.166666666666667
"6671","1990-09-24","A Revived U.N. Needs Lively Leaders",0.25
"6672","1990-09-24","U.S. Energy Options (and Habits)",0.333333333333333
"6673","1990-09-24","Shanghai Breezes",0
"6674","1990-09-24","Dole Hints at Revising Rates for Income Tax",-0.166666666666667
"6675","1990-09-24","MOSCOW PREMIER SAYS NATION FACES POTATO SHORTAGE",0
"6676","1990-09-25","Assessing Iraq's Latest Threat",-0.25
"6677","1990-09-25","College Paper Article Called Blatant Anti-Semitism",0
"6678","1990-09-25","Significant Losses Continue At S.& L.'s Not Held by U.S.",0.25
"6679","1990-09-25","Books of The Times;   Just 30 Years Later, Updike Has a Quartet",0.142857142857143
"6680","1990-09-25","Giants Find Taylor Not Hurt Seriously",0
"6681","1990-09-25","Letters to Judge Disclose New Details on Milken",0
"6682","1990-09-25","Gay Annapolis Graduate in Tuition Dispute",0.2
"6683","1990-09-25","Review/Theater;   A Musical in Which the Insects Sing",0
"6684","1990-09-25","Accounts",1
"6685","1990-09-25","Corrections",1
"6686","1990-09-25","Suit Accuses Maryland Of Bias Against Whites",0
"6687","1990-09-25","Uneasy Doctors Add Race-Consciousness to Diagnostic Tool",-0.166666666666667
"6688","1990-09-25","How to Answer Iraq's Threats",-0.333333333333333
"6689","1990-09-25","Senate, 94 to 1, Passes Bill to Protect the Benefits of Older Workers",0.285714285714286
"6690","1990-09-25","PRAISING DE KLERK, BUSH OFFERS HELP",0.4
"6691","1990-09-25","Interest Grows in Licensing Shortcut for 2 AIDS Drugs",0.333333333333333
"6692","1990-09-25","Clemens Is Cleared",0.5
"6693","1990-09-25","Subway Crime Statistics Rise",-0.25
"6694","1990-09-25","Our Towns;   A Gulf Question: Don't You Wish You Had Solar?",-0.166666666666667
"6695","1990-09-25","Author Cancels Trip After Threats in Texas",-0.2
"6696","1990-09-25","U.S. Views Threat by Iraq As Strategy to Split Critics",-0.5
"6697","1990-09-25","Gang Is Suspected in Woman's Death by Arson",-0.4
"6698","1990-09-25","Chess",0
"6699","1990-09-25","As Deadlines Near, Scientists Seek Data From Indian Bones",0
"6700","1990-09-25","Israelis Plan Retaliation for Killing of Soldier",-0.4
"6701","1990-09-26","Countdown to Automatic Cuts",-0.333333333333333
"6702","1990-09-26","Kentucky Begins Drive to Revitalize Its Schools",0
"6703","1990-09-26","Rangers Lose to Flyers,But King Is Effective",0
"6704","1990-09-26","CHRONICLE",0
"6705","1990-09-26","Space Agency Will Try to Loft Shuttle Discovery on Oct. 6",0
"6706","1990-09-26","Corrections",1
"6707","1990-09-26","U.S. in Court on Homes for Ex-Addicts",0.333333333333333
"6708","1990-09-26","De Klerk Says the U.S. Is His Model",0
"6709","1990-09-26","Retirement Set At Mobil Oil",0
"6710","1990-09-26","Swift and Wide Impact Is Expected If Negotiations on U.S. Budget Fail",0.142857142857143
"6711","1990-09-26","Daniel W. Hofgren, 54, Former Aide to Nixon",0.2
"6712","1990-09-26","Moody's Cuts Chase Ratings; Potential Losses Are Cited",-0.571428571428571
"6713","1990-09-26","House Speaker Is Criticized on Gun Control",-0.4
"6714","1990-09-26","The Many Faces of a Pennant Race",-0.25
"6715","1990-09-26","Emerson Electric Creates a Spinoff",0.25
"6716","1990-09-26","Mama Lu Parks, 61; Actress and Dancer Headed Jazz Troupe",0
"6717","1990-09-26","Metropolitan Diary",0
"6718","1990-09-26","Guinness Case Penalty",0
"6719","1990-09-26","Teachers Union Rejects an Offer From New York",0
"6720","1990-09-26","Broncos Lose Braxton",-0.333333333333333
"6721","1990-09-26","Full Scope Of Inquiry Into Milken",0.25
"6722","1990-09-26","In the Oil Trading Pit, Reflexes Must Be Fast",0
"6723","1990-09-26","Pentagon Decides to Lift Ban on Northrop, Drawing Fire",-0.142857142857143
"6724","1990-09-26","U.S. to Support U.N. on Children, But Money for Programs Is Scant",0.2
"6725","1990-09-26","Ruben de Saavedra, 57, Designer of Luxurious Residential Rooms",0.166666666666667
"6726","1990-09-27","U.S. CARGO FLEET IS FOUND WANTING",-0.25
"6727","1990-09-27","John J. Dorsey, Plastic Surgeon, 78",0
"6728","1990-09-27","New York City Needs Judges for Family Court",0
"6729","1990-09-27","Heads of Hispanic Groups Seek One Political Voice",0.142857142857143
"6730","1990-09-27","For Muscovites, A Pizza Purge",0
"6731","1990-09-27","Newsweek and Times Mirror Set Ad Pact",0
"6732","1990-09-27","Mets Are Getting Together At Right Place, Right Time",0.285714285714286
"6733","1990-09-27","Treasury Urges Restrictions On Bank Deposit Insurance",-0.166666666666667
"6734","1990-09-27","Victim's Wielding of Knife Questioned at Howard Beach Trial",-0.285714285714286
"6735","1990-09-27","Goetz Confronts Victim in Court In Suit Hearing",0.166666666666667
"6736","1990-09-27","The Korean Will to Democracy Grows Fainter",0.2
"6737","1990-09-27","CALIFORNIA TO GET TOUGHER AIR RULES",-0.2
"6738","1990-09-27","From Germany's Neighbors, Respect and Then Acceptance",0.5
"6739","1990-09-27","A Magazine for Every Child",0
"6740","1990-09-27","4-Year Treasury Notes Sell Well",0.2
"6741","1990-09-27","Bridge",0
"6742","1990-09-27","Soviets Take Step Toward Freedom of Religion",0.166666666666667
"6743","1990-09-27","Causing the Fidgets, Bart and the Flash",-0.25
"6744","1990-09-27","New Sun Printer And Software Out",0
"6745","1990-09-27","Calendar: Gardens, Old Prints",0
"6746","1990-09-27","Metro Matters;   Decades Later, A Pseudonym Is a Man's Armor",0
"6747","1990-09-27","EXECUTIVE CHANGES",-0.5
"6748","1990-09-27","HOME IMPROVEMENT",0.5
"6749","1990-09-27","BASEBALL: Notebook;   Fielder Proves His Value",0.2
"6750","1990-09-27","Review/Dance;   Flamenco Group Arrives From Spain",0
"6751","1990-09-28","Review/Music;   After the Hype, an Elaborate High-Tech Show for the Ninja Turtles Set",0
"6752","1990-09-28","Economic Watch;   Capital Gains: Plus, Minus or Neither?",0.285714285714286
"6753","1990-09-28","Stocks Fall As Oil Sale Impact Fades",-0.166666666666667
"6754","1990-09-28","Grogan Seems Unlikely to Face Jets",0
"6755","1990-09-28","New Housing Authority Chief",0.25
"6756","1990-09-28","WITH ACCORD NEAR, BUDGET TALK FOCUS IS SOCIAL SECURITY",0.285714285714286
"6757","1990-09-28","Directors Retiring At Campbell Soup",-0.25
"6758","1990-09-28","Archibald A. Talmage, Executive, 86",-0.333333333333333
"6759","1990-09-28","Judge Fines USX $4.1 Million in Conspiracy Case",-0.166666666666667
"6760","1990-09-28","Charles R. Kaufman, Lawyer, 81",0
"6761","1990-09-28","Sentencing of Milken Is Delayed by Judge",-0.5
"6762","1990-09-28","Family Ties for Yanks",0
"6763","1990-09-28","The Price for Silence",0
"6764","1990-09-28","Braggs's 2-Run Homer Sends Reds' Lead to 5",0
"6765","1990-09-28","Reviews/Film Festival;   Oh, to Banish Temptation From Life",-0.2
"6766","1990-09-28","Films That Are Shooting",-0.5
"6767","1990-09-28","New Bible: 'Thee' Goes Way of All Flesh",0
"6768","1990-09-28","G.O.P. Unit Accused of Illegal Fund Raising",-0.5
"6769","1990-09-28","Peter J. Ottley, 82, Head of Local In the Hotels and Hospital Union",0.142857142857143
"6770","1990-09-28","3 More Killed in India in Clashes Over Official Jobs for Poor",-0.5
"6771","1990-09-28","At the Movies",0
"6772","1990-09-28","Quotation of the Day",0
"6773","1990-09-28","Large Cutbacks At Laura Ashley",0
"6774","1990-09-28","HORSE RACING: Notebook;   Housebuster Confronts Biggest Test in Vosburgh",-0.25
"6775","1990-09-28","16 Convicted in Killing Of Aquino's Husband",-0.25
"6776","1990-09-29","Those Hisses on the Launching Pad",0
"6777","1990-09-29","Barge Owner Investigated In Oil Spill",-0.2
"6778","1990-09-29","From an Old Iraqi Battlefield, Warnings of New Bloodshed",-0.333333333333333
"6779","1990-09-29","Beliefs",0
"6780","1990-09-29","President Of Emerson Radio Quits",-0.25
"6781","1990-09-29","Japan and North Korea Set Talks on Ties",0
"6782","1990-09-29","Don't Coerce Quebec With Trade Exclusion",-0.4
"6783","1990-09-29","Your Money;   Ways to Trim Tax Liabilities",-0.4
"6784","1990-09-29","Two Soviet Giants, in Dissent",-0.25
"6785","1990-09-29","Photo: Beatriz Rodriquez as The Chosen One in Vaslav Nijinsky's ''Sacre du Printemps.'' (Jean Marc Charles Rapho for The New York Times) Contrite Paris Hails Nijinsky's 'Sacre'",0.142857142857143
"6786","1990-09-29","Rome Says Goodbye to Moravia With a Quiet but Loving Tribute",0.428571428571429
"6787","1990-09-29","Delegates From World Are Doing The Town",0
"6788","1990-09-29","Evolution in Europe: One Germany;   New Germany or Not, in the East It's Same Old Teachers, Same Old Books",0
"6789","1990-09-29","News Summary",0
"6790","1990-09-29","Review/Opera;   New Don in Title Role of the Met's 'Giovanni'",0
"6791","1990-09-29","John B. Goodman, Executive, 78",-0.333333333333333
"6792","1990-09-29","Ex-Aide to Pierce Rebuffs Questions in Inquiry on Housing Agency",-0.285714285714286
"6793","1990-09-29","Senators Block Bill to Regulate Cable TV Prices",-0.166666666666667
"6794","1990-09-29","Auction of Ford Artworks Planned",0
"6795","1990-09-29","Corrections",1
"6796","1990-09-29","Mutual Fund Buyers In a Flight to Safety",0.4
"6797","1990-09-29","COMBAT RESERVES MAY GET CALLED UP",-0.2
"6798","1990-09-29","RESULTS PLUS",0
"6799","1990-09-29","About New York;   First Problem Is Homelessness; 2d Is Denial",-0.333333333333333
"6800","1990-09-29","Leading Indicators In Big Fall",0.25
"6801","1990-09-30","Miss Cox Marries Philip Clippinger",0
"6802","1990-09-30","Moynihan's Law",0.5
"6803","1990-09-30","Television's Independents: Working on a Slippery Slope",0.2
"6804","1990-09-30","NOTED WITH PLEASURE",0.5
"6805","1990-09-30","Politics Overtake Selecting Nuclear Dump Sites",0.166666666666667
"6806","1990-09-30","Operatic Winds Blowing Every Which Way",-0.2
"6807","1990-09-30","Pop, Pre-Pop and Rivers",0
"6808","1990-09-30","New Yorkers, etc.",0
"6809","1990-09-30","Alison Lee Farn Is Married",0.25
"6810","1990-09-30","Checklist for Car Shoppers",0
"6811","1990-09-30","Hofstra Coach Is Slain on Sidewalk",0
"6812","1990-09-30","What It Means To Turn 50",-1
"6813","1990-09-30","Pro Football;   Eason Not Bitter in Return",0.2
"6814","1990-09-30","Review/Opera;   New Principals in 'Butterfly'",0.25
"6815","1990-09-30","Bush Is in New York for the U.N. Conference and a Flurry of Gulf Diplomacy",0.142857142857143
"6816","1990-09-30","Monterey",0
"6817","1990-09-30","Campus Life: Colorado;   After Coors Gift, Arena Renaming Angers Students",0
"6818","1990-09-30","West End Story: Sondheim Mania Hits London",0
"6819","1990-09-30","Corrections",1
"6820","1990-09-30","HOME ENTERTAINMENT/VIDEO: NEW VIDEO RELEASES",0
"6821","1990-09-30","Sakharov's Answer",0
"6822","1990-09-30","Review/Dance",0
"6823","1990-09-30","Mary Liboon Wed to J. E. Malaya 3d",0
"6824","1990-09-30","Pastimes;   Chess",0
"6825","1990-09-30","WILDMON'S WAR ON THE ARTS",0
"6826","1990-10-01","Dividend Meetings",0.5
"6827","1990-10-01","Yet Poland Had Many Heroic Rescuers of Jews",0.166666666666667
"6828","1990-10-01","Europe Hesitates on Unity",0.333333333333333
"6829","1990-10-01","6 Die in French Bus Plunge",-0.25
"6830","1990-10-01","Bridge",0
"6831","1990-10-01","Crime In Politics",0
"6832","1990-10-01","Gail A. Rosselot, Nurse, Is Married",0.5
"6833","1990-10-01","Charles R. Marshall Jr.; Psychiatrist, 39",0
"6834","1990-10-01","Lawrence Kasha, Stage Producer, 57; Won Tony Awards",0.142857142857143
"6835","1990-10-01","Auburn Sees Value of Ties",0.25
"6836","1990-10-01","A Veto Mr. Bush Can Still Avoid",-0.4
"6837","1990-10-01","Hussein Seeks a 'Debate' With France",-0.25
"6838","1990-10-01","McIlvaine's Move Looks Inevitable",0
"6839","1990-10-01","Plans for a Sludge-Treatment Plant Erode the Tranquillity of Bay Park",0
"6840","1990-10-01","Severed German Families, Starting Now to Mend",0
"6841","1990-10-01","Kurosawa Still Finding Unfamiliar Seas to Sail",-0.166666666666667
"6842","1990-10-01","Sony, Apple Negotiating Laptop Deal",0.2
"6843","1990-10-01","Jennifer B. Kane Weds C. N. Crapo",0
"6844","1990-10-01","Decision-Making Setup Revamped by Du Pont",0
"6845","1990-10-01","INSIDE",0
"6846","1990-10-01","Ball Parks Crumble, But Some Fans Stay On the Field Forever",0
"6847","1990-10-01","Question Box",-1
"6848","1990-10-01","Don't Call 14 Carriers an Extravagance",0.25
"6849","1990-10-01","You Can Get Shot Outside of New York, Too",-0.5
"6850","1990-10-01","Argentine Leader Sees Gulf Role As Best Way to Reverse Old Image",0.1
"6851","1990-10-02","The Souter Men's Club",-0.333333333333333
"6852","1990-10-02","A Book With Utter Nonsense That Makes Sense",-0.2
"6853","1990-10-02","Seeking to Resolve Hostage Issue, Lebanese Militia Frees 40 Shiites",0.25
"6854","1990-10-02","THE BUDGET AGREEMENT: Albany;   CUOMO CRITICIZES BUDGET AGREEMENT",0.142857142857143
"6855","1990-10-02","Associates Corp.'s Notes Yield 8.87%",0.25
"6856","1990-10-02","Seasons Sway Human Birth Rates",0.2
"6857","1990-10-02","CHRONICLE",0
"6858","1990-10-02","Training for Urban Combat",0
"6859","1990-10-02","Passage From 'Mein Kampf' Ignites Furor at Dartmouth",0
"6860","1990-10-02","Gen. Curtis LeMay, an Architect Of Strategic Air Power, Dies at 83",-0.125
"6861","1990-10-02","Millard Is Sidelined",0
"6862","1990-10-02","INSIDE",0
"6863","1990-10-02","Hastening Infertility",0
"6864","1990-10-02","3 in Connecticut Focus on Taxes In a TV Debate",-0.5
"6865","1990-10-02","Ruth C. Streeter, 94, Ex-Leader Of Women Reserves in Marines",0
"6866","1990-10-02","Supreme Court Roundup;   Justices to Hear Suit Over Quotations",0.571428571428571
"6867","1990-10-02","EXECUTIVE CHANGES",-0.5
"6868","1990-10-02","Rochester Murder Trial Begins",-0.25
"6869","1990-10-02","JVC and MCA in Venture",0
"6870","1990-10-02","Transcript of President's Address to U.N. General Assembly",0
"6871","1990-10-02","Now, Keep the Promises to Children",0.25
"6872","1990-10-02","White House Gets Bill Reducing Ads on Children's TV Programs",-0.142857142857143
"6873","1990-10-02","Newark Head Start Workers Strike Over Pay and Benefits",0.142857142857143
"6874","1990-10-02","4th Defendant Goes on Trial in Bensonhurst Case",0
"6875","1990-10-02","THE BUDGET AGREEMENT: The Executive View - Budget Pact Regarded As Mixed for Business;   Airlines: Bigger Burden For Fliers",-0.0769230769230769
"6876","1990-10-03","Washington's Men Did Not Eat Spam",0
"6877","1990-10-03","President's Address to Nation on Federal Deficit and the Budget Agreement",0
"6878","1990-10-03","Limits on Deductions Could Raise Bill for Affluent",-0.2
"6879","1990-10-03","William T. Kirby Is Dead at 79; A MacArthur Foundation Leader",-0.166666666666667
"6880","1990-10-03","U.S. Soccer Team To Play Soviets",0.25
"6881","1990-10-03","Dorothy P. Freeman, Donor of Wave Hill In Bronx, Dies at 99",-0.142857142857143
"6882","1990-10-03","Sam Wyche Needs Some Time Off",-0.25
"6883","1990-10-03","Drug Blast in Colombia Kills 9",-0.5
"6884","1990-10-03","Carlos Nunez Tellez, Sandinista Leader, 39",0
"6885","1990-10-03","Pivotal Moment for Bush",0.333333333333333
"6886","1990-10-03","Last of Door Ripped From Jetliner Is Retrieved From Ocean's Floor",-0.285714285714286
"6887","1990-10-03","Female Reporters See Renewed Resistance",0.2
"6888","1990-10-03","Grains and Soybeans Rise As Cattle Finishes Lower",-0.166666666666667
"6889","1990-10-03","Democratic Leader's Response To President's Budget Address",0.166666666666667
"6890","1990-10-03","Book Notes",0
"6891","1990-10-03","A Decision for Exit Visas Hastened East's Downfall",-0.333333333333333
"6892","1990-10-03","In Virginia Beach, a Community Works",0.25
"6893","1990-10-03","Fuel Economy and Auto Safety Don't Mix;   Clean Air Bill",0.111111111111111
"6894","1990-10-03","Manuscripts By Mozart To Be Sold",0
"6895","1990-10-03","Sonia Yuspeh, Founder Of Ad Firm, Dies at 62",-0.2
"6896","1990-10-03","Japan's Past Weighs",0
"6897","1990-10-03","Blue Jays Win, Then Get Some Good News",0
"6898","1990-10-03","Review/Dance;   French Jitterbugs Find a Future in Harlem's Past",0
"6899","1990-10-03","Big Companies May Benefit From Breaks for Small Ones",0.142857142857143
"6900","1990-10-03","Fuel Economy and Auto Safety Don't Mix",0
"6901","1990-10-04","Personal Health",0.5
"6902","1990-10-04","Factory Orders Rose 1.8% in August",0
"6903","1990-10-04","New York's Enduring Ethics Scandal",0.2
"6904","1990-10-04","New Layer of Budget Rules Arouses Skepticism From Experts",0
"6905","1990-10-04","One Lane to Be Open On the Bayonne Bridge",0.2
"6906","1990-10-04","Market Place;   Bearish View Pays Off for Funds",0.166666666666667
"6907","1990-10-04","KEY RATES",0
"6908","1990-10-04","France Stops Issuing Lebanese Visas, Citing Army Blockade",0
"6909","1990-10-04","Time Warner Is Reported In Talks on Canceled Book",-0.166666666666667
"6910","1990-10-04","...And Revenue Losers",-0.5
"6911","1990-10-04","Cooperstown? Hoboken? Try New York City",-0.166666666666667
"6912","1990-10-04","Murdoch to Merge Papers",0
"6913","1990-10-04","Police Plan Facing Hurdle in Precincts: Cynicism",-0.166666666666667
"6914","1990-10-04","Rules on Reviving the Dying Bring Undue Suffering, Doctors Contend",-0.375
"6915","1990-10-04","CHRONICLE",0
"6916","1990-10-04","Federated and Allied Outline Recovery Plan",0.2
"6917","1990-10-04","Partisan Dispute Stalls Order On Cuomo Registration Plan",-0.142857142857143
"6918","1990-10-04","For Florio, a New Caution Is Emerging",-0.25
"6919","1990-10-04","Ousted Federal Judges Loses Race for Florida Nomination",-0.285714285714286
"6920","1990-10-04","Board Chairman Quits at University in Capital",-0.2
"6921","1990-10-04","No Headline",0
"6922","1990-10-04","INSIDE",0
"6923","1990-10-04","Among Farmers, Anger Greets Prospect of Cuts",-0.166666666666667
"6924","1990-10-04","Low Voter Turnout in Primaries, Once Again",-0.25
"6925","1990-10-04","Thailand's Cigarette Ban Upset",-0.25
"6926","1990-10-05","BRIEFS",0
"6927","1990-10-05","Death-Penalty Delay Doesn't Promote Justice;   Community and Crime",0
"6928","1990-10-05","Canned Ham Is Recalled",0
"6929","1990-10-05","Death-Penalty Delay Doesn't Promote Justice;   Beaten Children",0
"6930","1990-10-05","Money Fund Assets Up",0.333333333333333
"6931","1990-10-05","Museum's New Sculpture Court Is Readied",0.2
"6932","1990-10-05","U.S. Withdraws Nomination of Envoy to Myanmar",0.25
"6933","1990-10-05","Bill Would Leave Kemp In Public Relations Slump",-0.166666666666667
"6934","1990-10-05","AIDS and Folk Healing, a Zimbabwe Encounter",0.4
"6935","1990-10-05","Kenneth Cohen, Academy Official, 66",0
"6936","1990-10-05","4,000 Years' Worth of This and That",0.5
"6937","1990-10-05","A Touch of the East Comes to the Bronx",0.25
"6938","1990-10-05","Deal Is Near For a Czech Auto Maker",0
"6939","1990-10-05","Decision on Dickerson Upheld by Tagliabue",0.25
"6940","1990-10-05","Layoffs? Dinkins Lied, Irate Union Chief Asserts",0
"6941","1990-10-05","Stringent Rules on Death Penalty Added to Anti-Crime Bill in House",-0.285714285714286
"6942","1990-10-05","Gingrich, in Duel With White House, Stays True to His Role as an Outsider",0
"6943","1990-10-05","Ryan Stays a Ranger",0
"6944","1990-10-05","Agatha Moran Leather, Teacher, 77",0
"6945","1990-10-05","UAL Financing Short of Goal",-0.25
"6946","1990-10-05","5 Teen-Agers Wounded By Gunfire in New York",-0.2
"6947","1990-10-05","Financial Printers Have Suffered Since '87 Crash",-0.2
"6948","1990-10-05","Bertha Lindsay, 93; Was the Last Eldress In the Shaker Society",0
"6949","1990-10-05","People",0
"6950","1990-10-05","Corrections",1
"6951","1990-10-06","Corrections",1
"6952","1990-10-06","Maastricht Journal;   The Dutch Forget the Work Ethic and Call In Sick",0
"6953","1990-10-06","CHRONICLE",0
"6954","1990-10-06","Edward F. Merrey, Lawyer, 79",0
"6955","1990-10-06","In the Bronx, a Ritual of Grief They Know by Heart",0.2
"6956","1990-10-06","Yanks Drop 2 Veterans",-0.333333333333333
"6957","1990-10-06","Religion Notes",0
"6958","1990-10-06","MacLean's Injury Status Is Reported Not Serious",0
"6959","1990-10-06","BUSINESS DIGEST: SATURDAY, OCTOBER, 6, 1990",0
"6960","1990-10-06","Fog Equipment Is Approved",0.333333333333333
"6961","1990-10-06","Vocational Schools Train Millions for Life",0.2
"6962","1990-10-06","New Jersey Shifts Plan For 'At Risk' Students",0
"6963","1990-10-06","Conviction in Child's Death",-0.333333333333333
"6964","1990-10-06","At Tom's, Coffee And Civility As You Like It",0.5
"6965","1990-10-06","Treatment for a Met",0
"6966","1990-10-06","Vocational Schools Train Millions for Life;   We Need Regulation",0
"6967","1990-10-06","News Summary",0
"6968","1990-10-06","New York City's Grim Task: Deciding Whom to Lay Off",-0.285714285714286
"6969","1990-10-06","Reds Bring Down Pirates By Cutting Down Runners",-0.2
"6970","1990-10-06","Missing Forwards at Nets Camp",0
"6971","1990-10-06","Argentine Phone Sale Is Snagged",0
"6972","1990-10-06","Pakistan Election Open to All Parties",0.25
"6973","1990-10-06","CONSUMER'S WORLD: Guidepost;   Fresh Wild Mushrooms",0
"6974","1990-10-06","Vocational Schools Train Millions for Life;   Cut Off The Money",0
"6975","1990-10-06","Polly Peck Delay on Debt",-0.25
"6976","1990-10-07","College Football;   Lions Come Up Short",0
"6977","1990-10-07","Miss Stewart Weds Thomas Crimmins",-0.2
"6978","1990-10-07","Strategies in Selma",0
"6979","1990-10-07","College Football;   Miami Romps in Ground Attack",-0.166666666666667
"6980","1990-10-07","Are Plazas Public Boons, or Nuisances?",-0.25
"6981","1990-10-07","Results Plus",0
"6982","1990-10-07","Dazzlers From Navajo Looms",-0.333333333333333
"6983","1990-10-07","HOME ENTERTAINMENT/RECORDINGS: AND KEEP IN MIND",0
"6984","1990-10-07","'Crooked Hearts' Probes the Pain of Family Life",-0.166666666666667
"6985","1990-10-07","Venture Capital's Assault on The Genetic Code",-0.2
"6986","1990-10-07","Voodoo Demographics",0
"6987","1990-10-07","Miss Fairchild, Student, to Wed",-0.25
"6988","1990-10-07","Europe for Less: It Can Be Done;   Berlin",0
"6989","1990-10-07","Richard Schwarz, 39, Movie Theater Owner",0
"6990","1990-10-07","Corrections",1
