"","pub_date","main","score"
"4384","1990-06-25","Drug-Test Plan Rejected",-0.333333333333333
"4385","1990-06-25","Bridge Loan for Trump Expected",0
"4386","1990-06-25","Miss Bernstein Becomes Bride",-0.25
"4387","1990-06-25","Lace Factory And Artistry Of Old World Quietly Fade",0
"4388","1990-06-25","Corrections",1
"4389","1990-06-25","Metro Datelines;   Soviet Doctor Killed By Mugger in Queens",-0.142857142857143
"4390","1990-06-25","Elizabeth F. Otey, A Lawyer, Weds",0
"4391","1990-06-25","A Party, A Binge, A Void",-0.333333333333333
"4392","1990-06-25","Hunters Point, Now or Maybe Never",-0.4
"4393","1990-06-25","INSIDE",0
"4394","1990-06-25","The Mandela Visit;   Washington, About to Receive Mandela, Is Worried About de Klerk",-0.142857142857143
"4395","1990-06-25","Corrections",1
"4396","1990-06-25","Metro Datelines;   2d Arrest in Bombing Of Anti-Drug Family",-0.166666666666667
"4397","1990-06-25","Economic Calendar",0.5
"4398","1990-06-25","AIDS Protesters Drown Out Health Secretary",0
"4399","1990-06-25","Question Box",-1
"4400","1990-06-25","India Taking Measures To Reduce Oil Imports",0.333333333333333
"4401","1990-06-26","Flutie Signs in Canada",0
"4402","1990-06-26","Congress Was Right",0.5
"4403","1990-06-26","AIDS and Misdirected Rage",0
"4404","1990-06-26","Cheney Says Western Aid to Moscow Is a Mistake",0
"4405","1990-06-26","Sony Digital Sales Good",0.25
"4406","1990-06-26","Canada and Quebec Ratings On Debt Are Reaffirmed",0
"4407","1990-06-26","Jazz Festival;   Shorter and Nascimento: Joy in Sharing",0.5
"4408","1990-06-26","MacHelp With Writing",0
"4409","1990-06-26","Second Key Gene of Immune System is Found",0
"4410","1990-06-26","Margot Austin; Children's Author, 81",0.25
"4411","1990-06-26","Chase Seeks to Reduce Its Costs by $300 Million",-0.4
"4412","1990-06-26","Witness Tells About Sexual Encounter With Barry",0
"4413","1990-06-26","Two Votes Show Public Is Wary of Tax Increases",-0.428571428571429
"4414","1990-06-26","Armco Anticipates A Loss for Quarter",-0.25
"4415","1990-06-26","EUROPE HASTENING INTEGRATION PACE",0.25
"4416","1990-06-26","BRIEFS",0
"4417","1990-06-26","Correction",1
"4418","1990-06-26","Nets Trade '93 and '95 Draft Picks For Theus",-0.2
"4419","1990-06-26","Michelin Planning To Cut 2,260 Jobs",-0.25
"4420","1990-06-26","Chronicle",0
"4421","1990-06-26","President Gets Amtrak Bill Without Takeover Provision",-0.142857142857143
"4422","1990-06-26","Ruling Near On Savings Fraud Data",0
"4423","1990-06-26","Accord Averts Debate on Rights Bill",0
"4424","1990-06-26","Chronicle",0
"4425","1990-06-26","Better News From Israel",0.333333333333333
"4426","1990-06-27","How Distinct Is Quebec? French, and That's That",0.25
"4427","1990-06-27","Gerard Appy, 69, Dies; A Public-TV Executive",-0.4
"4428","1990-06-27","For Trump, Seeds of a Comeback",0.333333333333333
"4429","1990-06-27","White House Moves to Limit Cuts in Salvador Military Aid",-0.125
"4430","1990-06-27","BUSH CUTS BACK AREAS OFF COASTS OPEN FOR DRILLING",0.142857142857143
"4431","1990-06-27","The Azzurri Make Italy Shut Down",0
"4432","1990-06-27","New Leader Chosen For Lehman College",0.2
"4433","1990-06-27","Sharpton Defense Declines to Call Witnesses",0
"4434","1990-06-27","Saatchi Acts To Change Its Culture",0.25
"4435","1990-06-27","Citibank Visa Offers Long-Distance Calls",0.4
"4436","1990-06-27","Senate and Administration Agree on Housing Bill",0
"4437","1990-06-27","Jazz Festival;   Pearl Bailey Elevates Her Philosophical Side",0.142857142857143
"4438","1990-06-27","Book Notes",0
"4439","1990-06-27","Review/Ballet;   10 Dancers Win Prizes at New York Competition",0
"4440","1990-06-27","Matching Those Who Need Guidance With Those Who Have Been There",-0.333333333333333
"4441","1990-06-27","Eating Well",0.5
"4442","1990-06-27","Books of The Times;   Havel Discusses Writers and Politics",0.333333333333333
"4443","1990-06-27","Steinbrenner Report to Stay Private",0
"4444","1990-06-27","Trial Set in Booby Trap Death",-0.4
"4445","1990-06-27","The Vatican Warns Catholic Theologians Over Public Dissent",-0.166666666666667
"4446","1990-06-27","Broadway Adopts A Plan to Cut Costs And Ticket Prices",-0.285714285714286
"4447","1990-06-27","Antitrust Break for Insurers Helps Consumers;   Mutual Life Elections",-0.125
"4448","1990-06-27","Recalling Mickey Katz",0
"4449","1990-06-27","To Eat Broccoli, Be Cunning",0
"4450","1990-06-27","Liberty to Reject Life",0
"4451","1990-06-28","Hispanic District in Los Angeles",0.25
"4452","1990-06-28","Dr. Helen Miller, 93, An Obstetrician, Dies",-0.25
"4453","1990-06-28","Chronicle",0
"4454","1990-06-28","Anniversary With Little to Celebrate",0.333333333333333
"4455","1990-06-28","Kemper Marley Sr. Is Dead at 83; Name Arose in '76 Slaying Inquiry",-0.142857142857143
"4456","1990-06-28","Trevino and Caddie Having Good Years",0.25
"4457","1990-06-28","Appeals Panel Rules Against WPIX-TV",0.25
"4458","1990-06-28","Designs for Europe;   Germany in NATO? Not Important",0.2
"4459","1990-06-28","The Mandela's Schedule",0
"4460","1990-06-28","Amre Inquiry",0
"4461","1990-06-28","Louisiana Measure To Block Abortions Is Sent to Governor",0
"4462","1990-06-28","Review/Architecture;   A Restored Grand Army Plaza, With a New Coat for the General",0.25
"4463","1990-06-28","EXECUTIVE CHANGES",-0.5
"4464","1990-06-28","Quotation of the Day",0
"4465","1990-06-28","BUSINESS DIGEST",0
"4466","1990-06-28","Stock Market Bills Backed",0.25
"4467","1990-06-28","Metro Datelines;   Hasidic Rabbi Beaten By Hasidic Youths",0
"4468","1990-06-28","It's Farewell For Planners On a Panel",0
"4469","1990-06-28","Short of Earth? Gardens Bloom In Jars and Pots",-0.166666666666667
"4470","1990-06-28","New Haven's Bond Rating Is Downgraded by Moody's",0
"4471","1990-06-28","Abducting Suspects Breaks All the Laws",-0.25
"4472","1990-06-28","FINANCE BRIEFS",0
"4473","1990-06-28","Prices of Treasuries Rise Slightly",-0.25
"4474","1990-06-28","TLC Beatrice Continues Realigning Top Posts",0.166666666666667
"4475","1990-06-28","Aide Says Hungary Gave Refuge in '79 To Terrorist Carlos",0.285714285714286
"4476","1990-06-29","People",0
"4477","1990-06-29","Engelhard, Aiding Shift, Names No. 2 Executive",0
"4478","1990-06-29","Review/Film;   When a Comedian Becomes an Institution",0
"4479","1990-06-29","The Cost of Soviet Disintegration . . .",-0.333333333333333
"4480","1990-06-29","At the Movies",0
"4481","1990-06-29","Washington Talk;   For Freshman Senator, A Unifying Budget Role",0
"4482","1990-06-29","Rinfret Comes Out Swinging",0.333333333333333
"4483","1990-06-29","Sports People: BASEBALL;   Rose Sentencing Report To Reach Judge Soon",-0.111111111111111
"4484","1990-06-29","Mike Jones, Boxing Manager, 55",0
"4485","1990-06-29","Corrections",1
"4486","1990-06-29","A.M.A. Supports Testing of French Abortion Pill",0.166666666666667
"4487","1990-06-29","NEWS SUMMARY",0
"4488","1990-06-29","Basketball;   The Making of a Deal: How the Magic Got Scott",0.166666666666667
"4489","1990-06-29","Fernandez Is to Expand Use Of School Metal Detectors",0.166666666666667
"4490","1990-06-29","Britain Accepts Rover Ruling",0.25
"4491","1990-06-29","Dinkins Nears Pact to Raise Property Taxes",-0.333333333333333
"4492","1990-06-29","Results Plus;   Liberty Cup Winner",0.2
"4493","1990-06-29","Our Towns;   Watch the Birds; They Divebomb On This Island",0
"4494","1990-06-29","Agreement Allows Minolta To Market Polaroid Camera",0.333333333333333
"4495","1990-06-29","Tracking Crimes of Prejudice: A Hunt for the Elusive Truth",-0.333333333333333
"4496","1990-06-29","4 Projects Honored For Design",0.333333333333333
"4497","1990-06-29","U.S. AND JAPAN SET ACCORD TO RECTIFY TRADE IMBALANCES",0.166666666666667
"4498","1990-06-29","Jazz Festival;   Pearl Bailey's Pop and the Blues of Wynton Marsalis",0.125
"4499","1990-06-29","Traffic Alert",0.5
"4500","1990-06-29","Throughout Westchester, Relics of a Revolutionary Past",0
"4501","1990-06-30","Universe Yields Secrets To Us Only Grudgingly",-0.5
"4502","1990-06-30","Nasty? Try New York",-0.5
"4503","1990-06-30","Stolen Treasure: Three Stories",0
"4504","1990-06-30","Garcias' Extortion Convictions Are Reversed by Appeals Panel",0.166666666666667
"4505","1990-06-30","Searchers End Attempt To Find Flood Victims",0
"4506","1990-06-30","Back Pain Idles Stillwell",-0.25
"4507","1990-06-30","Jubilation, With Dignity",1
"4508","1990-06-30","Government Bans Mercury in Interior Latex Paints",0
"4509","1990-06-30","Herky-Jerky Bang-Bang",0
"4510","1990-06-30","RESULTS PLUS",0
"4511","1990-06-30","U.S. SPACE AGENCY GROUNDS SHUTTLES OVER A FUEL LEAK",-0.166666666666667
"4512","1990-06-30","Marcos Jury Adjourns for Day",0
"4513","1990-06-30","William E. Davies, 72, Of Geological Survey",0
"4514","1990-06-30","COMPANY BRIEFS",0.5
"4515","1990-06-30","Newsprint Recycling Becomes Law for Papers in Suffolk",0.166666666666667
"4516","1990-06-30","All Are One at the African Street Festival",0.25
"4517","1990-06-30","KEY RATES",0
"4518","1990-06-30","Congress Goes Home, Still for Sale",0
"4519","1990-06-30","Naval Intelligence and Fallibility Contemplated;   Taking Responsibility",0.333333333333333
"4520","1990-06-30","U.S. Sells Centrust for $86 Million",0
"4521","1990-06-30","Here's a New York Site for Homeless Housing",0
"4522","1990-06-30","Evolution in Europe: Deir Hanna Journal;   When Poetry Is Seared In the Fire of the Mideast",-0.111111111111111
"4523","1990-06-30","Campbell to Shed Its Fresh-Foods Group",0
"4524","1990-06-30","Bank Revamping In New England",0
"4525","1990-06-30","Council Gains Budget Pact With Dinkins",0.4
"4526","1990-07-01","Campus Life: U.C.L.A.;   Amid Pressure, Expansion Plan Is Trimmed Again",0
"4527","1990-07-01","An Evening at Shea Is a Stroll in the Park",0
"4528","1990-07-01","Compact Camcorders Slug It Out",-0.333333333333333
"4529","1990-07-01","Can the U.S. Really Handle a World Cup?",0
"4530","1990-07-01","PROFIT KEY WINS",0.333333333333333
"4531","1990-07-01","A LOST GENERATION OF AMERICANS IS COMING HOME",0.2
"4532","1990-07-01","Men vs. Women",0
"4533","1990-07-01","Seattle's Succulent Clams",0
"4534","1990-07-01","American Blacks Talk of Change As Main Legacy of Mandela Visit",0.125
"4535","1990-07-01","The Nation;   A Divided Supreme Court Ends the Term With A Bang",0.142857142857143
"4536","1990-07-01","Pastimes;   Stamps",-0.5
"4537","1990-07-01","Q and A",NA
"4538","1990-07-01","Popular Films Are Feeding the Series Maw",0.2
"4539","1990-07-01","Don't Let Japan Open a Pi Gap With U.S.",0
"4540","1990-07-01","FORECAST FOR 'TODAY': CLOUDY",0
"4541","1990-07-01","For a Rose Fancier, The Older, the Better",0.25
"4542","1990-07-01","MOTHERS ARE A GIRL'S BEST FRIEND",0.5
"4543","1990-07-01","No Headline",0
"4544","1990-07-01","Lifestyle;   The Vanities, They Were Oh So Tepid",-0.333333333333333
"4545","1990-07-01","Answering The Mail",0
"4546","1990-07-01","Four Other Actors on the German Stage",0
"4547","1990-07-01","Lawsuit Complicates Bid to Buy MGM/UA",0
"4548","1990-07-01","Legislators Seek New Compromise On Air Terminal",0.166666666666667
"4549","1990-07-01","Lodges in Rugged, Remote Maine",0.25
"4550","1990-07-01","PAPERBACK BEST SELLERS: July 1, 1990",0.25
"4551","1990-07-02","Review/Television;   Mastering the Movies, for a While",0.333333333333333
"4552","1990-07-02","Time Warner Accuses Pathe of Double Sales",-0.333333333333333
"4553","1990-07-02","England Stops Cameroon",0
"4554","1990-07-02","New Jersey Tax Increases Take Effect",0
"4555","1990-07-02","Jazz Festival;   Stan Getz, Weaving His Moods",0.166666666666667
"4556","1990-07-02","IN THE NATION New Taxes for What?",-0.333333333333333
"4557","1990-07-02","'Grapes of Wrath': Raves and a Tony Do Not Breed a Hit",0
"4558","1990-07-02","Metro Matters;   Maybe a Picture Can Be Worth 1,000 Votes Too",0.142857142857143
"4559","1990-07-02","On Many Farms, a Season of Disaster",-0.25
"4560","1990-07-02","Evolution in Europe;   For Average East Germans, Wonder and Some Trepidation    East Berlin: 'It's Got to Be Better Than What We Had'",0.181818181818182
"4561","1990-07-02","Review/Art;   Courtland Collection Settles Into New Home",0.166666666666667
"4562","1990-07-02","Limits Are Sought On Games, Practice",0.5
"4563","1990-07-02","Jazz Festival;   Embracing Tradition",0.75
"4564","1990-07-02","Business Scene;   Times Are Tough For U.S. Builders",0
"4565","1990-07-02","A Datamarine Founder Is Ousted From Posts",-0.5
"4566","1990-07-02","Handling of Winfield Is Key Part Of Inquiry",0
"4567","1990-07-02","No-Hitter, but With No Glory",0.5
"4568","1990-07-02","New Dailies Proliferate in Spain as Ads Surge",0.2
"4569","1990-07-02","Mets Rally in the 9th To Edge Reds, 3-2",0
"4570","1990-07-02","A Genuinely Affirmative Action",0.666666666666667
"4571","1990-07-02","Soviet Effort for Patent Law Reform Gaining Momentum",0.285714285714286
"4572","1990-07-02","Reporter's Notebook;   Keeping Emotions Under Control at Jogger Trial",0
"4573","1990-07-02","New U.S. Arms Initiative",0
"4574","1990-07-02","PC/Computing Growth",0
"4575","1990-07-02","On Your Own;   At Last, An End To Lost Locks",-0.25
"4576","1990-07-03","Southwestern Public Service Co.  reports earnings for Year to May 31",-0.142857142857143
"4577","1990-07-03","Chronicle",0
"4578","1990-07-03","Wells American Corp. reports earnings for Qtr to March 31",0.142857142857143
"4579","1990-07-03","Review/Music;   Sacred and Contemporary From Russia",0.25
"4580","1990-07-03","Firstcorp Inc. reports earnings for Qtr to March 31",0
"4581","1990-07-03","Rig Count Is Steady",0.333333333333333
"4582","1990-07-03","New Retail Concepts Inc. reports earnings for Year to March 31",0
"4583","1990-07-03","Designatronics Inc. reports earnings for Qtr to May 31",0
"4584","1990-07-03","Citizens Utilities reports earnings for Qtr to March 31",0.166666666666667
"4585","1990-07-03","Comterm Inc. reports earnings for Qtr to April 30",0
"4586","1990-07-03","Genetic Factor Emerges as Key to Onset of Lyme Arthritis",0
"4587","1990-07-03","NEW SCHOOL BOARD REFLECTS MOSAIC OF NEW YORK CITY",0
"4588","1990-07-03","Fashion;   Sprightly Clothes for Cruise or Career",0.4
"4589","1990-07-03","King vs. Douglas: Case Begins in Federal Court",0.166666666666667
"4590","1990-07-03","More Than One Way to Aid Khmer Rouge",0.2
"4591","1990-07-03","Company News;   U S Sprint to Offer Soviet Service",0.166666666666667
"4592","1990-07-03","Orenda Forest Products reports earnings for Year to March 31",0.142857142857143
"4593","1990-07-03","Company News;   Hercules Chief Retiring",0
"4594","1990-07-03","T Cell Sciences Inc. reports earnings for Qtr to April 30",0
"4595","1990-07-03","Hipotronics Inc. reports earnings for Qtr to June 2",0
"4596","1990-07-03","ADS Associates Ltd.  reports earnings for Qtr to April 30",0.166666666666667
"4597","1990-07-03","Adelphia Communications Corp. reports earnings for Qtr to March 31",0.142857142857143
"4598","1990-07-03","Meadow Group Inc. reports earnings for Qtr to April 30",0
"4599","1990-07-03","The Public Must Reject 2 Live Crew's Message;   Clearly Obscene",0.125
"4600","1990-07-03","Joseph C.R. Licklider Dies at 75; Foresaw New Uses for Computers",0
"4601","1990-07-04","Safety Board Blames Captain In '89 Jet Crash in East River",0
"4602","1990-07-04","For Poles, Baseball And Rotary Foster American Dreams",0.166666666666667
"4603","1990-07-04","Liberian Rebels Close In on City Center",-0.2
"4604","1990-07-04","The Pop Life",0
"4605","1990-07-04","Beeba's Creations Inc. reports earnings for Qtr to May 31",0
"4606","1990-07-04","Tennis;   At Wimbledon, Garrison Ends Seles's Streak",0
"4607","1990-07-04","Results Plus",0
"4608","1990-07-04","Saks Hasn't Met Its Goals In First Half, Memo Says",0
"4609","1990-07-04","Bronx Gunman Was Obsessed, Prosecutor Says",0
"4610","1990-07-04","Evolution in Europe;   Yugoslav Mass Grave Linked to Communists",-0.142857142857143
"4611","1990-07-04","Jurors in Sharpton Trial Had Doubts Over Funds",-0.2
"4612","1990-07-04","Daily News Unions Ask Cuomo for State Inquiry",0.142857142857143
"4613","1990-07-04","U.S. Petroleum Data",0
"4614","1990-07-04","Chronicle",0
"4615","1990-07-04","Picnics: Declaring the Spirit of a People",0
"4616","1990-07-04","Hockey;   Trottier Released by Islanders; Club Buys Out His Contract",0
"4617","1990-07-04","Chapman S. Root, 65, A Coca-Cola Bottler",-0.25
"4618","1990-07-04","Carolina Freight Corp. reports earnings for Qtr to June 16",0
"4619","1990-07-04","Literacy Cup That Erred",0
"4620","1990-07-04","Lloyd W. Hazleton, 79, Biological Researcher",0
"4621","1990-07-04","Evolution in Europe;   Romanian President Backs Economic Reform Program",0.25
"4622","1990-07-04","Chronicle",0
"4623","1990-07-04","American Freed in Ecuador Savors Home and the Town That Saved Him",0.285714285714286
"4624","1990-07-04","Topics of The Times;   Fashion Report",0.25
"4625","1990-07-04","World Cup '90;   England Asks for Heart, Spirit, Luck",0.285714285714286
"4626","1990-07-05","In Italy, a Gloomy Day After",-0.333333333333333
"4627","1990-07-05","Carter Receives Liberty Medal",0.25
"4628","1990-07-05","Books of The Times;   Overcoming a Lifetime's Motivations to Drink",0.333333333333333
"4629","1990-07-05","CHRONICLE",0
"4630","1990-07-05","CHRONICLE",0
"4631","1990-07-05","Myra S. Eckstein, Student, Is a Bride",0
"4632","1990-07-05","An Aggressive Easy Goer Wins Suburban",0
"4633","1990-07-05","After Seven Months, Ramos Is Going Home",0
"4634","1990-07-05","Robber Commits Suicide",-0.333333333333333
"4635","1990-07-05","Land-Buying Drive by Pentagon Runs Into Stiff Resistance in West",-0.285714285714286
"4636","1990-07-05","Items Worth $45 Million Missing From a U.S. Lab",0
"4637","1990-07-05","Total in Dart Attacks Rises to 26 Women",-0.2
"4638","1990-07-05","Herman Goldfarb, 68, Is Dead; Executive Helped Crime Inquiry",-0.428571428571429
"4639","1990-07-05","Small Renoir at Louvre Is Stolen in Daylight",-0.2
"4640","1990-07-05","Job for Beber Silverstein",0
"4641","1990-07-05","Review/Dance;   Waiting Impatiently for the Train to Chaos",-0.4
"4642","1990-07-05","Agonizing in Sweden: Welcome or Ouster for 150 Soviet Jews?",0
"4643","1990-07-05","Founder of Kaypro Sees Life in the Company Yet",0
"4644","1990-07-05","Madrid Journal;   Spain Frets a Bit as Third-World Tide Sweeps In",-0.25
"4645","1990-07-05","Stocks Fall In London",-0.333333333333333
"4646","1990-07-05","EXECUTIVE CHANGES",-0.5
"4647","1990-07-05","A Stylistic Departure For I.B.M.",0
"4648","1990-07-05","Target Practice, With Public Money",0.25
"4649","1990-07-05","Rest-Home Resident, 90, Cleared of Killing 3",0
"4650","1990-07-05","Quotation of the Day",0
"4651","1990-07-06","Fire Out of Control in Alaska",-0.333333333333333
"4652","1990-07-06","Fredrika Blair-Hastings, Author, 71",0.333333333333333
"4653","1990-07-06","UAL Suspends Jet Purchase Talks",-0.2
"4654","1990-07-06","Sounds Around Town",0.333333333333333
"4655","1990-07-06","Ernst Barred From Taking New York Work for 45 Days",-0.142857142857143
"4656","1990-07-06","Hans-Rudolf Kurz, Military Historian, 75",0
"4657","1990-07-06","Review/Television;   West Africa's Echoes in New Orleans",0
"4658","1990-07-06","KEY RATES",0
"4659","1990-07-06","TV Weekend;   An Evening of Series, With Art, Love and War",0.166666666666667
"4660","1990-07-06","Diner's Journal",0
"4661","1990-07-06","Review/Jazz;   Grizzled Tone, Sure Logic",0.2
"4662","1990-07-06","East German Auto Plant on the Brink",0
"4663","1990-07-06","Estonian Veterans Reunion Postponed as Soviet Armored Column Arrives",0.125
"4664","1990-07-06","Dozens Arrested in Miami at Haitian Protest",-0.2
"4665","1990-07-06","Garrison Upsets Graf at Wimbledon",-0.25
"4666","1990-07-06","Sidney Fread, 74, Dies; A Corporate Executive",-0.4
"4667","1990-07-06","Cut the Custodians Down to Size",-0.333333333333333
"4668","1990-07-06","Mitch Snyder, 46, Advocate of Homeless",0
"4669","1990-07-06","Ulster Negotiations Delayed As Dublin Considers Its Role",0.166666666666667
"4670","1990-07-06","A Corporate Doctor Is Getting Fewer Calls",0
"4671","1990-07-06","Review/Film;   A Cat That Can Show People's True Colors",0
"4672","1990-07-06","Review/Art;   Alice Aycock's Mighty Sculptures",0.2
"4673","1990-07-06","Prosecutor to Ask Probation For Two Christian Scientists",0
"4674","1990-07-06","Steinbrenner Has Day In Baseball's Court . . .",0.25
"4675","1990-07-06","Three Howard Beach Retrials Are Scheduled for Aug. 28",0
"4676","1990-07-07","Control Data Acts To Sell VTC Unit",0
"4677","1990-07-07","Evolution in Europe;   Daughter of Brezhnev Wins Return of Seized Valuables",0.125
"4678","1990-07-07","Seymour Baumrind, Rabbi, 70",0
"4679","1990-07-07","CHRONICLE",0
"4680","1990-07-07","Has Anybody Seen the Soccer Fans?",0
"4681","1990-07-07","Suburbs Are Wary of Bears' Wanderlust",-0.25
"4682","1990-07-07","Evolution in Europe;   Excerpts From Speech by Yeltsin Before 28th Party Congress",0
"4683","1990-07-07","Twins Plead Innocent In Glen Ridge Case",0.166666666666667
"4684","1990-07-07","Louisiana Bill Would Require Warnings on Recordings",0
"4685","1990-07-07","Sweeney Schriner, Hockey Player, 78",0
"4686","1990-07-07","Travels in the U.S.: Savings Via Coupon Or Club",0.2
"4687","1990-07-07","For Minority Broadcasters, a Role in What Is Seen and Heard",0
"4688","1990-07-07","Evolution in Europe;   Text of the Declaration After the NATO Talks",0
"4689","1990-07-07","NATO ALLIES, AFTER 40 YEARS, PROCLAIM END OF COLD WAR; INVITE GORBACHEV TO SPEAK",0
"4690","1990-07-07","Fall at Window Kills an Infant In Kew Gardens",-0.333333333333333
"4691","1990-07-07","Evolution in Europe;   Calming the Waters",0.25
"4692","1990-07-07","Fed Voted in May Against Lower Rates",-0.4
"4693","1990-07-07","Davis to Get a Start",-0.333333333333333
"4694","1990-07-07","Truck Driver Killed in Holdup",-0.25
"4695","1990-07-07","The Beat Goes On for Young Rhythmic Gymnast",-0.2
"4696","1990-07-07","INSIDE",0
"4697","1990-07-07","William McCarthy, 73, Retired Police Official",-0.2
"4698","1990-07-07","Navratilova Going for No. 9",0
"4699","1990-07-07","Blues Make Bid For Stevens",0
"4700","1990-07-07","Another Tough Loss For Hawkins",-0.25
"4701","1990-07-08","Maradona Raises the Stakes",-0.333333333333333
"4702","1990-07-08","Misuse of Savings Bailout Reported in Texas Purchase",0
"4703","1990-07-08","A Passion for Chocolate",0.5
"4704","1990-07-08","Wall Street;   T-Shirts: In Leaner Times, the Little Guys Are Losing",-0.125
"4705","1990-07-08","Topics of the Times;   Mitch Snyder's Anger",-0.2
"4706","1990-07-08","Reflections on World Cup 1990",0
"4707","1990-07-08","State Is Disappointed By Gambling Revenues",-0.25
"4708","1990-07-08","New Yorkers, etc.",0
"4709","1990-07-08","EVOLUTION IN EUROPE: A New Face For NATO;   Military Must Change As the Threat Wanes",-0.2
"4710","1990-07-08","Question of the Week;   Who Is Baseball's Best Player Now?",0
"4711","1990-07-08","Q and A",NA
"4712","1990-07-08","Carolyn P. Sawin To Wed in August",0
"4713","1990-07-08","Jennifer Clarke Is Wed",0
"4714","1990-07-08","300 Haitians March at Site Of Violent Protest in Miami",-0.333333333333333
"4715","1990-07-08","Fashion;   Refreshing a Summer Wardrobe",0.25
"4716","1990-07-08","Food;   SAY CHEEEESE!",0
"4717","1990-07-08","Calling a Book a Book",0.333333333333333
"4718","1990-07-08","The Characters Are in Charge",-0.5
"4719","1990-07-08","Harold Hirsch, 82; Started White Stag, Sportswear Concern",-0.142857142857143
"4720","1990-07-08","Birth Pains;   Now Playing on the World Stage: The Taming of the New",0
"4721","1990-07-08","U.S. Viewers Get A Faulty Picture",-0.25
"4722","1990-07-08","Navratilova Wins a Record Ninth Wimbledon Singles Title",0
"4723","1990-07-08","FICTION",0
"4724","1990-07-08","Steinbrenner May Have Ally in Fehr",0.25
"4725","1990-07-08","Topics of the Times;   Luggage, Lost and Found",-0.2
"4726","1990-07-09","Many Census Aides Are Denied Chance For Jobless Benefits",0
"4727","1990-07-09","Nekoosa Unit's Ex-Chief To Lead Wausau Paper",0.166666666666667
"4728","1990-07-09","New York Told To Base Raises On Job Needs",-0.285714285714286
"4729","1990-07-09","Davis Takes Title, Stopping Breland",0
"4730","1990-07-09","Books of The Times;   Transcending a Family's Dark Side",-0.166666666666667
"4731","1990-07-09","Ms. Mallin Weds James K. Hanson",0
"4732","1990-07-09","Metro Datelines;   600 Rikers Prisoners Skip Meals in Protest",-0.285714285714286
"4733","1990-07-09","Bonnie Honig Weds Michael Whinston",0.2
"4734","1990-07-09","Police Officer Stabbed in Jerusalem",-0.25
"4735","1990-07-09","Retail Deal Expected For Trump",0
"4736","1990-07-09","Bridge",0
"4737","1990-07-09","Deep-Water Ports Offer Solution to Oil Spills",0.166666666666667
"4738","1990-07-09","RESULTS PLUS",0
"4739","1990-07-09","Violence And Hypocrisy",-1
"4740","1990-07-09","Jamie Columbus Becomes a Bride",0
"4741","1990-07-09","'Degenerate' Artworks Survive Triumphant Over Nazi Degradation",0
"4742","1990-07-09","Edberg Overcomes Becker To Regain Wimbledon Title",0.166666666666667
"4743","1990-07-09","RICO Reform: A Second Windfall for S & L Crooks",-0.2
"4744","1990-07-09","Bill Cullen, 70, Host and Panelist On Many TV Game Shows, Dies",-0.125
"4745","1990-07-09","Mines Kill Sri Lanka Soldiers",-0.4
"4746","1990-07-09","Some U.S. Arts Grants Turned Down in Protest",-0.25
"4747","1990-07-09","Shattering Glass Added To the City Symphony",0
"4748","1990-07-09","Zebra Mussel Threatens Economy and Ecology",-0.2
"4749","1990-07-09","In the Zodiac Case, Still More Riddles Than Clues",0
"4750","1990-07-09","Chile and U.S. to Begin Talks on Freeing Trade",0.2
"4751","1990-07-10","Thrift Crooks in Jail",-0.333333333333333
"4752","1990-07-10","Corrections",1
"4753","1990-07-10","HarperCollins Buys 3 Jeffrey Archer Books",0.2
"4754","1990-07-10","Majestic Electronic Stores reports earnings for Year to Feb 28",0.142857142857143
"4755","1990-07-10","Corrections",1
